Nome,Data,Genero,Descri,url
O Poderoso_Chefao,1972,Crime_Drama,A historia da familia Corleone uma poderosa organizacao mafiosa e de como Michael Corleone relutantemente assume o comando,https://macabra.tv/wp-content/uploads/2022/03/O-Poderoso-Chef%C3%A3oposter-filme-MacabraTV.jpg
Clube da Luta,1999,Drama e Suspense,Um homem comum insatisfeito com sua vida cria um clube secreto de luta com um vendedor carismatico,https://periodico.sites.uepg.br/images/essa.jpg
A Origem,2010,Ficcao Cientifica e Suspense,Em um mundo onde e possivel invadir os sonhos das pessoas um ladrao de segredos e contratado para plantar uma ideia na mente de um executivo A missao e complexa e leva a uma jornada que questiona o que e realidade,https://br.web.img3.acsta.net/medias/nmedia/18/87/32/31/20028688.jpg
Forrest Gump,1994,Drama e Romance,A vida extraordinaria de Forrest Gump um homem com um QI baixo mas que vive eventos historicos e conhece figuras importantes A historia explora temas de amor amizade e superacao,https://upload.wikimedia.org/wikipedia/pt/c/c0/ForrestGumpPoster.jpg
O Senhor dos Aneis,2001,Fantasia e Aventura,Frodo um hobbit recebe a missao de destruir um poderoso anel para impedir o retorno do maligno Sauron Com a ajuda de amigos leais ele embarca em uma jornada epica pela Terra Media,https://br.web.img3.acsta.net/medias/nmedia/18/92/91/32/20224832.jpg
Matrix,1999,Ficcao Cientifica e Acao,Thomas Anderson descobre que o mundo que conhece e uma simulacao controlada por maquinas Junto com um grupo de rebeldes ele luta para libertar a humanidade e desafiar a Matrix,https://br.web.img2.acsta.net/medias/nmedia/18/91/08/82/20128877.JPG
